{
  "schema_version": "1.0.0",
  "run_id": "demo-run",
  "attempt_id": "attempt-01",
  "captured_at": "2026-06-23T00:00:00Z",
  "decision_state": "not-evaluated",
  "assurance": "A1-local-observed",
  "plan": {
    "path": "plan/workflow.plan.json",
    "sha256": "0000000000000000000000000000000000000000000000000000000000000000"
  },
  "run_contract": null,
  "subject": {
    "kind": "git-repository",
    "repository": ".",
    "head": "0123456789abcdef0123456789abcdef01234567",
    "dirty": true,
    "snapshot_sha256": "0000000000000000000000000000000000000000000000000000000000000000",
    "status_sha256": "0000000000000000000000000000000000000000000000000000000000000000",
    "index_diff_sha256": "0000000000000000000000000000000000000000000000000000000000000000",
    "worktree_diff_sha256": "0000000000000000000000000000000000000000000000000000000000000000",
    "untracked_sha256": "0000000000000000000000000000000000000000000000000000000000000000",
    "submodules_sha256": "0000000000000000000000000000000000000000000000000000000000000000",
    "repository_label": "repository",
    "repository_locator_sha256": "0000000000000000000000000000000000000000000000000000000000000000"
  },
  "collector": {
    "name": "keelplane-capture-local",
    "version": "0.2.0",
    "origin": "local-observed",
    "platform": "example",
    "python": "3.12.0",
    "git": "git version 2.x"
  },
  "harness": {
    "name": "codex",
    "version": null,
    "auth_mode": "subscription-declared",
    "session_refs": []
  },
  "invocations": [],
  "agent_results": [],
  "artifacts": [],
  "commands": [],
  "reviews": [],
  "gates": [],
  "budgets": [],
  "redaction": {
    "policy_sha256": null,
    "content_capture": "metadata-only"
  },
  "retention": "project",
  "ledger": {
    "path": "hashes/ledger.json",
    "sha256": "0000000000000000000000000000000000000000000000000000000000000000"
  },
  "event_log": null,
  "attestations": [],
  "warnings": [
    "Example only."
  ]
}
